10/02/2025;Cours;Nantes/Paris;;;6,5;Réveil direct, on se prépare rapidement avec Eugé, on prend le métro puis on se quitte à Montparnasse, 2h de train, je me sens larveux, lis peu et dors sans que ça soit très efficace, vais à la BU au lieu d'aller en cours, 40 minutes de deep learning, RU hôtel Dieu solo puis vais à l'appart, me pose au lit, beaucoup sur le tel, mini sieste, TP AMULT  durant lequel je suis passif pendant 3h, Matteo fait le taff, met de l'essence puis rentre à l'appart, encore un peu de deep learning, ça fait plaisir de bosser, me prépare le dîner puis vais à QPUC, ne suis pas bon, moins de plaisir ce soir, rentre, nourris le chat et nettoie sa litière, dodo en lisant le monde de Sophie;06:40:00;06:41:00;23:24:00;23:32:00;;103;279;76;12;;;83;38;0;Moyen;Aucun;8639;0;;;23;35;46;118;0;;;;;;;;;Saine;Moyen;;Aucun;;;;10:48:00;;73;;;;8;;;;;;;25;23;40;20;0;0;;63;Correct;5,7;114;0;1;0;;;;0;;0;;;;;;0;;0;;60;0;;;Train;;0;0;0;1;;0;0;0;0;0;;;0;;;0;0;0;0;;0;0;1;1;0;0;0;0;;1;1;;;;;Rêve que j'essaie de m'échapper du jardin d'une maison dans laquelle je me suis tapé une incruste, puis cours vers petit port. Raison : j'ai nourri le chat la veille chez Pauline, suis rentré dans leur maison;;;
11/02/2025;Cours;Nantes;;;6,5;Réveil direct, arrive un peu en retard en gestion de projet, prépare mon powerpoint du bilan de l'alternance pour la visio avec Saïd et Fernanda, on passe à l'oral pour le projet de Léo, puis mets à jour les BDD journées et film, déjeuner rapide puis lis un peu à la médiathèque, un peu en cours puis réunion à 15h, ça dure 1h, ça se passe bien, achète l'écran d'ordinateur puis essaie de vendre ma place pour le marathon, rentre à l'appart, lis un peu puis sieste de 20 minutes salvatrice, dîne puis vais au ciné, 5 septembre avec Daphné, film très intéressant, on passe en vitesse au comptoir avec elle puis rentre à l'appart, on s'organise avec Eugé pour qu'elle vienne ce week-end en bus, elle vient, ça régale, dodo avec le Monde de Sophie;07:22:00;07:22:00;23:31:00;23:35:00;;95;313;46;11;;;79;38;0;Assez en forme;Aucun;7290;0;;;22;20;44;117;0;;;;;;;;;Assez saine;Correct;;Aucun;;;;08:45:00;;75;;;;30;;;;;;;33;35;21;7;0;0;;56;Correct;9,5;234;0,2;1;0;;;;0;;0;;;;;;0;;0;;20;0;;;;;0;0;0;0;;0;1;1;0;0;;;0;;;0;0;0;0;;0;0;1;0;0;0;0;0;;1;1;;Daphné ;;Rêve que je suis à Versailles le soir, Margaux est dans mon rêve, on est en voiture mais aussi dans une sorte de hall d'hôtel, elle me dit qu'elle fait des prestations pour gagner des sous, puis on repart en voiture et une galère arrive (je sais plus c'était quoi). Rêve aussi qu'Alix me demande de la récupérer près de gare du Nord, n'ai pas la foi d'attendre et prend mon train à Montparanasse. Raison : on a réfléchi aux trains avec Eugé la veille pour son arrivée ce week-end, + ai réfléchi à un éventuel pot le lundi ou mardi après Renault;;;;
12/02/2025;Cours;Nantes;;;6,5;Réveil direct, douche puis CB inutile qui me fait perdre 20 minutes. Je ne prends donc pas de petit-déj puis TP Amlut de 2h où j'alterne entre travail et passivité sur l'ordi, ça se passe bien, CM où j'avance sur mon streamlit de films, déjeuner solo rapide puis lis rapidement à  la médiathèque. Réunion projet puis allemand où j'avance un peu streamlit. Ne fais pas la séance de sport, vais à la médiathèque, dors 30 minutes et lis un tout petit peu. Rentre à l'appart en passant par chez Moncada pour chercher les bouquins puis dîner à l'appart, CP puis vais au comedy club avec Bianca et ses potes d'archi, bon moment, on va au Soon boire un petit coup, sympa, puis rentre à l'appart, étends le linge puis dodo avce le monde de Sophie. 40 minutes de lecture mais peut-être près d'1h15 sur mon livre, du mal à être concentré surtout quand je lis de la philo;07:20:00;07:20:00;00:13:00;00:20:00;;117;244;47;18;;;72;34;0;Correct;Aucun;10012;0;;;22;30;46;114;0;;;;;;;;;Correct;Beaucoup;1 pinte de cidre  ;Assez peu;;;;08:36:00;;111;;;;62;;;;;;;40;41;32;1;0;0;;73;Moyen;11,1;24;0;1;0;;;;0;;0;;;;;;1;;1;;20;0;;Stand up;;;0;0;0;0;;0;0;0;0;0;;;0;;;0;0;0;1;;0;0;1;0;0;0;0;0;;1;1;;Bianca;;;Rêve que je cours le marathon non préparé en ayant mal, en doudoune, avec un sac, ça ne fait sens. En plus on part après tout le monde juste avant la tombée de la nuit. Je souffre au niveau du 30e km et décide d'arrêter. Pleure un coup puis essaie de finir. Ne me rappelle pas de la suite;;;
13/02/2025;Cours;Nantes;;;7;Réveil direct, arrive un peu en retard en TP d'audio mais le prof n'est pas là, reçois le mail de Salameh sur l'engagement citoyen, ça me soule, n'ai pas envie d'avoir de conséquence à cause de la scol, reste un peu à Centrale puis rentre à l'appart, lis un peu et petite sieste, CB au réveil puis direction le RU hôtel Dieu, galère à cause d'une manif, Motte Rouge-RU à pied, mange solo puis appelle le gars à qui je revends ma place du marathon, arrive à la BU, avance 1h30 sur le deep learning, lis au 6e, petite sieste et continue de lire le monde de Sophie, commence le nettoyage des fichiers Sonodis puis avance mon streamlit perso, vais à la fontaine manger sur place puis me pose au Mcdo pour continuer à lire, cinématographe avec Nico M, la religieuse, pas trop aimé, on parle à Commerce pendant 25 minutes en attendant mon tram, rentre à l'appart, appelle Eugé puis me couche avec le monde de Sophie. 10 jours sans sport, je commence à sentir la fatigue;07:25:00;07:25:00;00:50:00;00:58:00;;117;295;54;1;;;84;42;0;Moyen;Aucun;13094;0;;;23;40;48;123;0;;;;;;;;;Correct;Un peu;;Aucun;;;;13:11:00;;175;;;;26;;;;;;;87;27;14;17;0;0;;41;Médiocre;10,8;0;12,9;1;0;;;;0;;0;;;;;;0;;1;;20;0;;;;;0;0;0;0;;0;1;1;0;0;;;0;;;1;0;0;0;;0;0;1;0;0;0;0;0;;1;1;;Nicow;10 jours sans sport, je commence à sentir la fatigue;;;;;
14/02/2025;Cours/Week-end;Nantes/Evreux;;;6;Réveil un peu lent (CB), petit-déj puis vais en cours, avance bien le streamlit perso pendant les 2h de cours, rentre à l'appart pour préparer les affaires, TP appli de 3h où on ne fait pas grand-chose avec Matteo, content de rentrer à Evreux, prends 3 personnes en blablacar, sympas (surtout Jordan), arrive à la maison, dîner rapide puis vais chercher Eugé à Mantes car est arrivée trop tard à Saint Lazare, on arrive à la maison, fatigué, elle dîne puis on traîne un peu, teste l'écran portable qui fonctionne, suis content, dodo avec le tel. Je mets 6 parce que la journée de cours était sans intérêt (hormis streamlit) et que j'ai passé ma fin de journée dans la voiture, mais bon mood car content de rentrer;08:45:00;09:26:00;01:39:00;01:45:00;;113;273;62;47;;;;37;0;Correct;Aucun;5060;0;;;21;0;45;106;0;;;;;;;;;Correct;Beaucoup;;Aucun;;;;10:43:00;;70;;;;20;;;;;;;0;34;16;3;0;0;;50;Correct;9;12;0;0;0;;;;0;;0;;;;;;0;;1;;0;0;;;Voiture;;1;0;0;1;;0;0;0;0;0;;;0;;;0;0;0;0;;0;0;0;0;0;0;0;1;;0;0;;;;;;;;
15/02/2025;Week-end;Evreux/Rouen;;;7;Temps calme puis on se rendort, réveil, petit-déj, vais chez le coiffeur à 11h, raté, Eugé va courir, pendant ce temps me rase et ne fais pas grand-chose, lis un peu, déjeuner tardif puis on part à Rouen, je me fait arnaquer 2 euros par une garce, elle était pas cool avec Eugé, on va au musée des beaux arts, sympa, puis on va au printemps et galeries, petite balade puis on rentre pour le dîner, ça faisait du bien de sortir, on est fatigué, on va au lit assez rapidement et m'endors avec le monde de Sophie;10:00:00;10:17:00;23:23:00;23:35:00;;97;391;115;12;;;84;35;0;Correct;Aucun;13283;0;;;21;0;44;111;0;;;;;;;;;Assez saine;Beaucoup;;Aucun;;;;;;;;;;;;;;;;;26;30;14;5;0;0;;44;Pas mal;3,4;312;0;0;0;;;;0;;;;;;;;0;;0;;30;1;;Musée des beaux arts;Voiture;;1;0;0;1;;0;0;0;0;0;;;0;;;0;0;0;0;;0;0;0;0;0;0;0;1;;1;1;;;;;;;;
16/02/2025;Week-end;Evreux;;;7,5;Réveil rapide, puis une matinée au soleil à lire et à traîner un peu, le temps fait très plaisir, déjeuner avec Eugé et les parents puis on se balade rapidement au soleil, ça fait du bien, dommage d'avoir un peu traîné le matin, la balade aurait été plus longue, on va au ciné avec Eugé (the Brutalist), long, film pas mal mais qui a ses défauts, on rentre, dîner avec les parents, débat virulent avec papa sur la cérémonie des JO, il ne sait pas débattre, prends mes billets pour Amsterdam et Bruxelles, dors avec le monde de Sophie;09:50:00;09:55:00;23:54:00;00:01:00;;125;247;36;11;;;73;40;0;Assez en forme;Aucun;6989;0;;;19;0;44;97;0;;;;;;;;;Correct;Pas mal;;Aucun;;;;;;;;;;;;;;;;;98;17;9;2;0;0;;26;Très beau temps;5,9;470;0;0;0;;;;0;;;;;;;;0;;0;;30;0;;;;;1;0;0;1;;0;1;1;0;0;;;0;;;0;0;0;0;;0;0;0;0;0;0;0;1;;1;1;;;;;;;;
17/02/2025;Alternance;Guyancourt/Evreux;;;6,5;Préparation rapide puis départ pour Versailles avce Eugé, l'équipe Squad commence une réunion à 9h, pris de cours, me gare à Versailles pour suivre la réu, vais chez Renault, pause avec Margaux et Thomas, bosse un peu avant le déjeuner, déjeuner avec eux, pause midi de 2h, bosse un peu l'aprem, reprise en douceur, seulement 2h de travail efficaces, goûter avec Thomas et Margaux chez elle, sympa, rentre à Evreux, fatigué, content d'être en TT le lendemain, dîne avec les parents, prends mes billets pour Italie-Fribourg, traîne avec mon tel au lit, dommage de perdre autant de temps le soir, le facteur fatigue a eu son importance dans mon coucher sans livre;07:00:00;07:00:00;23:49:00;23:54:00;;138;293;88;2;;;88;39;1;Assez fatigué;Aucun;6151;0;;;24;0;46;117;0;;;;;;;;;Assez saine;Beaucoup;;Aucun;240;;;11:09:00;;120;;104;;17;;;;;;;0;42;22;10;0;0;;64;Très beau temps;7,6;540;0;1;0;;;;0;;0;;;;;;0;;0;;90;0;;;Voiture;;1;0;0;1;;0;0;0;0;0;;;0;;;0;0;0;0;;0;0;0;0;0;0;0;0;;0;0;;;;;;;;
18/02/2025;Alternance;Evreux;;oui;8,5;Réveil lent (CB), mets énormément de temps à me mettre au travail, mais bonne session d'une heure, déjeuner puis me pause au soleil au salon, continue à bosser pour Renault (méthode ternaire), réunion avec l'équipe Squad, il me restera le paramétrage avec les curseurs à faire, vais sur mon tel puis vois la story de Sarah Knafo qui cherche un data scientist, cherche à la contacter, via un commentaire sur insta puis sur linkedin avec Stanislas Rigault, elle me parle, lunaire, je n'en reviens pas, une mission sur l'AFD m'attend, dîner avec les parents sous le signe de l'excitation, travaille de 21h50 jusqu'à 3h20 du mat pour obtenir un petit dashboard, suis content, ce qui se passe est lunaire, dors avec le monde de Sophie;08:35:00;09:05:00;04:03:00;04:05:00;;79;148;63;26;;;62;49;0;Assez en forme;Correct;2510;0;;;21;0;46;87;0;;;;;;;;;Assez saine;Beaucoup;;Aucun;300;;;10:42:00;;406;;90;;60;;;;;;;7;50;77;16;0;0;40;127;Beau temps;8,3;450;0;0;0;;;;0;;0;;;;;;1;;1;;30;0;;;;;1;0;0;0;;0;0;0;0;0;;;0;;;0;0;0;0;;0;0;0;0;0;0;0;0;;1;1;;;;;Rêve que je m'apprête à partir en bateau avec Sam et Flo, je crois qu'il y avait Emma et d'autres personnes, mais je devais me couper les ongles de doigt de pied et me suis mis en retard;;;
19/02/2025;Alternance;Evreux;;oui;6;Réveil difficile, très fatigué, me prépare très lentement puis avance pour Renault, déjeune puis au lit, dommage d'être sur le tel, perds du temps + CB, sieste minuscule, finis la partie sur les widgets, montre le rendu à la team squad, ils sont contents, me motive à finir la mission Knafo sans les prêts, envoie sur le chat et à elle la carte avec les stats, pas de réponse, dîner avec les parents puis petite balade avec eux et Twist qui fait du bien, prépare mes affaires, prends en photo des pages du livre de De Villiers pour prendre des notes puis finis le monde de Sophie avant de dormir;09:21:00;10:00:00;23:08:00;23:18:00;;116;265;79;2;;;86;35;1;Fatigué;Très peu;6073;0;;;27;10;46;123;0;;;;;;;;;Assez saine;Pas mal;;Aucun;240;;;11:07:00;;220;;100;;25;;;;;;;40;41;30;6;10;0;15;81;Correct;11,1;80;0;0;0;;;;0;;0;;;;;;2;;0;;30;0;;;;;1;0;0;0;;0;0;0;0;0;;;0;;;0;0;0;0;;0;0;0;0;0;0;0;0;;1;1;;;;;;;;
20/02/2025;Alternance;Guyancourt/Nantes;;;6,5;Me prépare rapidement puis papa me dépose au blablacar à la gare, très long pour arriver à Versailles, arrive chez Renault à 10h10, journée pas efficace, c'est dommage car j'ai pas mal de travail avec l'interaction entre les widgets et mettre au propre les deux notebook, déjeuner avec Fernanda, Isabelle et deux autres collègues, ennuyant, aprem aussi peu efficace que le matin, vais à Austerlitz, assez long, finis le livre de Saqué, 4h de train, commence le livre de Bastié, sieste rapide puis avance sur l'interaction entre les widgets, plus de travail que prévu, ça va être chaud de finir demain matin, je vais au kebab la Fontaine, Emma me rejoint, on va au royal café, moment sympa, rentre en tram puis tard à me coucher, sur mon tel avant de dormir;07:00:00;07:05:00;01:42:00;01:50:00;;119;212;45;1;;;72;36;0;Moyen;Très peu;9946;0;;;24;15;47;129;0;;;;;;;;;Moyenne;Un peu;;Aucun;240;;;10:33:00;;217;;0;;64;;;;;;;56;37;38;24;0;0;2;75;Médiocre;14,3;0;1,6;0;0;;;;0;;0;;;;;;1;;0;;30;0;;;Blablacar/Train;;0;0;0;0;;0;0;0;0;0;;;0;;;1;0;0;1;;0;0;1;0;0;0;0;0;;0;0;;Emma;;;;;;
21/02/2025;Alternance/Week-end;Nantes/Venise;;oui;6,5;Réveil un peu lent mais me met rapidement au travail, pas le choix, je dois finir le travail des widgets, et envoyer pour ne pas prendre mon ordi en voyage, bosse bien mais n'y arrive pas, cette mission est largement plus longue que ce que je pensais, prépare mes affaires pour aller à l'aéroport, prends un sandwich et y vais, lis un peu de Bastié puis déclare la prime d'activité à la CAF à l'aéroport, avion où je travaille un tout petit peu, dors une bonne partie sans que ça soit reposant et lis un tout petit peu, arrive à Venise, vais en bus dans l'île, marche jusqu'à l'appart, Venise est très beau, mets à jour les 2 dernières journées dans la BDD puis on se balade avec Eugé, sympa, on cherche le TGTG pui son mange à l'appart, que de la pizza ou des sandwichs, un peu écoeurant à la fin, temps calme puis m'endors en lisant Bastié;08:07:00;08:42:00;23:04:00;23:13:00;;102;321;134;35;;;83;32;0;Moyen;Très peu;12649;0;;;29;10;50;121;0;;;;;;;;;Mauvaise;Beaucoup;;Aucun;180;;;09:30:00;;134;;0;;20;;;;;;;30;37;28;2;0;0;1;65;Correct;;;;0;0;;;;0;;;;;;;;0;;1;;0;1;;;Avion;;0;0;0;1;;0;0;0;0;0;;;0;;;0;0;0;0;;0;0;0;0;0;0;0;1;;1;1;;;;;Rêve qu'on est avec la famille de parrainage des claquettes, Jules dit des phrases et on doit dire si on est d'accord ou pas (sujets sociétaux), ça commençait à devenir intéressant mais me fait réveiller par Eugé. Rêve aussi d'un match de rugby, sûrement Irlande-Galles;;;
22/02/2025;Vacances;Venise;oui;;8;Réveil un peu lent, on se prépare, on mange une salade de poulpe à deux avec des fritures, puis glace, on se pose au soleil dans un café, ça fait très plaisir, on lit, on continue de se balader, on va à place saint Marc, on continue de lire dans un jardin à côté, on va au musée Guggenheim, pas trop dedans, regarde la fin de Galles-Irlande, me sens un peu faible, on se balade vers l'église Santa Maria, on cherche un TGTG à la gare, on dîne à l'appart, regarde la fin d'Angleterre-Ecosse, l'Ecosse échoue de peu, dégoûté, me sens assez faible, au lit, temps calme puis dodo très dodo en continuant de lire de Bastié. Très bonne journée, ça méritait plus si je me sentais mieux sur la deuxième partie de la journée;09:05:00;09:30:00;22:02:00;22:10:00;;65;478;19;16;;;64;36;1;Correct;Aucun;18544;0;;;26;0;49;134;0;;;;;;;;;Moyenne;Beaucoup;;Aucun;;;;;;;;;;;;;;;;;80;27;30;5;0;0;0;57;Pas mal;;;;1;0;;;;0;;;;;;;;0;;0;;0;2;;Musée Guggenheim;;;0;0;0;1;;0;0;0;0;0;;;0;;;0;0;1;0;;1;0;0;0;0;0;0;1;;1;1;;;;;Rêve que je suis dans une boucle informatique, c'est un peu chelou mais dû au fait que je suis légèrement malade. (rêve de trucs bizarres quand je me sens pas au top). Mais sinon je fais une soirée assez chill pour mon anniv avec les étalons, les parents, Margaux est également là. Rêve aussi de Carl et Romi;;;
23/02/2025;Vacances;Venise/Vérone;oui;;8;Réveil assez rapide, me sens toujours légèrement malade, on se balade dans le nord de Venise, près de l'appart, on rentre préparer les affaires, prends les ordis dans mon sac, on se balade, rooftop fermé, on cherche un bar, mini embrouille car je suis de mauvaise humeur à cause de ma méforme et mal au dos à cause du sac, mais on trouvé un café, ça va mieux, on est posés au soleil, on lit, vrai plaisir, on se lève pour manger des pâtes à emporter, on se pose sur un banc, devant une fanfare, on lit, on va au quartier de l'arsenal, on trouve un bar, France-Italie au rugby, on les défonce, ça fait plaisir, rejoins Eugé au muséedell'Accademia, reste seulement 45 minutes, on rentre à l'appart après avoir mangés un kabab et une glace, on prend les affaires, train pour Vérone, bosse pour Renault dedans, on arrive à l'airbnb, mets à jour la journée puis temps calme et dodo avec le livre de Bastié. J'aurais mis, comme la veille, un peu plus que 8 si je me sentais en pleine forme lors de la première partie de la journée;07:48:00;08:09:00;23:50:00;23:58:00;;97;315;67;1;;;87;43;1;Correct;Aucun;28013;0;;;25;0;50;143;0;;;;;;;;;Médiocre;Pas mal;;Aucun;;;;20:16:00;;45;;;;30;;;;;;;90;33;30;19;0;0;7;63;Pas mal;;;;0;0;;;;0;;;;;;;;0;;0;;0;1;;Musée dell'Accademia;Train;;0;0;0;1;;0;0;0;0;0;;;0;;;1;0;1;0;;2;0;0;0;Rugby;0;0;1;;1;1;;;;;;;;
24/02/2025;Vacances;Vérone;oui;;9;Réveil un peu lent, dommage car on aurait pu se poser au soleil plus tôt, on se prépare puis on prend un petit-déj à emporter chez Mcdo, mini balade puis on va au supermarché, je fais des courses pour une mendiante qui me demandais de l'argent, puis on se pose au soleil en terrasse, quel plaisir immense, finis le livre de Bastié, ça fait plaisir, puis on rejoint David et Daphné qui étaient au bar juste à côté, on se balade puis on prend une pizza proche de l'Adige, un plaisir d'être tous les 4, on se balade l'aprem, entre le centre et la colline, très belle aprem, David m'impressionne dans son intelligence, et capacité à lire de gros bouquins, on passe rapidement à l'appart, puis on se pose encore en terrasse à la place centrale des arènes, commence, le livre de Bonaparte/De Gaulle et avance pour Renault, presque fini la mission des widgets, on va au restau avec Eugé, un beau moment, on rentre à l'appart, mets un peu de temps à mettre à jour la BDD, pas la force de bosser pour Renault, on s'endort rapidement. Alors oui on aurait pu être un peu plus actif le matin mais la journée reste exceptionnelle;07:58:00;08:38:00;22:50:00;22:57:00;;154;271;82;7;;;86;39;1;En forme;Aucun;19257;0;;;19;0;47;131;0;;;;;;;;;Médiocre;Beaucoup;;Aucun;;;;18:20:00;;70;;;;20;;;;;;;65;30;30;3;0;0;2;60;Beau temps;;;;0;0;;;;0;;;;;;;;0;;0;;15;0;;;;;0;0;0;1;;0;0;0;0;1;;;1;;;1;0;1;0;;2;0;1;0;0;0;0;1;;1;1;;David, Daphné;;;;;;
25/02/2025;Vacances;Milan/Vérone;oui;;8;Réveil très efficace, finis la mission pour Renault à l'appart, envoie les fichiers même si les graphs ne s'affichent pas, on prend encore un petit-déj à emporter chez Mcdo, balade très rapide à Vérone, on visite l'arène, il fait moins beau, encore en terrasse dans la place centrale, lis un peu De Gaulle et Napoléon même si je ne suis pas très efficace, on va vers le flixbus, il pleut, il a du retard, on mange à côté d'une station service en mode gitan, bus dans lequel je lis un peu mais écoute surtout l'heure des pros, et dors un peu, on arrive à Milan, métro jusqu'à chez Anouk, on papote chez elle, puis balade dans le centre, il pleut mais tant pis, on se pose dans une boulangerie puis dans un bar, Boltz vient avec son peps, on va dans un restau italien, c'était très bon et pas cher, très bon moment tous les 4, on rentre chez Anouk pour prendre les affaires, puis je dors chez Boltz, dodo rapide;07:31:00;07:38:00;00:38:00;00:43:00;;101;255;16;6;;;63;36;0;Assez en forme;Aucun;27797;0;;;21;10;46;121;0;;;;;;;;;Assez saine;Pas mal;1 pina collada;Très peu;;;;08:06:00;;50;;;;5;;;;;;;50;35;25;8;15;0;16;75;Mauvais temps;;;;0;0;;;;0;;;;;;;;0;;0;;0;0;;;Car;;0;0;0;1;;0;0;0;0;1;;;0,5;;;0;0;1;1;;1;0;1;0;0;0;0;0;;0;1;;Anouk, Boltz;;;Théophile est dans mon rêve, dans un contexte Centrale je crois;;;
26/02/2025;Vacances;Fribourg/Genève/Milan;oui;;7,5;Réveil et préparation rapide chez Boltz, on se quitte et vais encore au Mcdo acheter le petit-déj, on se rejoint avec Eugé dans un café à côté de la station de métro, Anouk nous rejoint, je leur dit au revoir, vais à la station de flixbus, attends le car assez longuement, me demande si je l'ai raté, il arrive avec 1h10 de retard, car durant lequel je lis et écoute l'heure des pros puis un podcast sur la philosophie (Aristote puis Weil), il fait beau après la matinée terne, ça fait plaisir, le trajet dans les alpes est très sympathique, me dis que je dois bosser la philo, arrive à Genève, on se rejoint avec Elisa, un premier bar puis starbuck avec Kylian qui nous rejoint, moment sympa, prends le train pour Fribourg, mets à jour la BDD et continue de lire DG et Napoléon, Laetitia me récupère à la gare, arrive à Philantropos, ambiance très sympa, aime bien le lieu et la stimulation intellectuelle, dodo avec le tel;07:01:00;07:10:00;23:53:00;00:01:00;;125;289;119;7;;;91;45;0;Correct;Aucun;12138;0;;;22;0;48;124;0;;;;;;;;;Assez saine;Pas mal;;Aucun;;;;;;;;;;;;;;;;;100;39;47;14;29;2;6;117;Mi médiocre, mi très beau temps;;;;0;0;;;;0;;;;;;;;0;;0;;30;0;;;Car/Train;;0;1;0;1;;0;0;0;0;0;;;0;;;0;0;0;1;;1;0;1;0;0;0;0;0;;0;0;;Anouk, Elisa;;;Rêve qu'Eugé travaille à Genève, que je suis en région parisienne, que j'ai très envie de la voir donc je prends la route mais au bout d'une heure j'abdique car je suis trop fatigué, on pleure car on ne va pas se voir;;;
27/02/2025;Vacances;Fribourg;oui;;7;Réveil assez lent à Philanthropos, me prépare, mange un bout puis cours sur la philosophie politique, intéressant mais manque de concentration, déjeuner sympa avec Laetitia, Galdric, Luc et une autre fille, je me présente devant tout le monde, mini sieste, cours toute l'aprem sur la doctrine sociale de l'Eglise, prof intéressant mais manque de concentration encore une fois, découvre les encycliques, messe puis dîner avec Laetitia, Laurenne et Nils, très sympa puis témoignage de Luc, intéressant, monte me coucher, sur mon tel avant de dormir. Une belle journée à Philanthropos;09:01:00;09:20:00;23:40:00;23:45:00;;134;304;66;15;;;86;47;0;Assez en forme;Aucun;2978;0;;;20;10;44;102;0;;;;;;;;;Saine;Pas mal;;Aucun;;;;;;;;;;;;;;;;;0;15;27;10;0;0;0;42;Mi beau temps mi médiocre;;;;0;0;;;;0;;;;;;;;0;;0;;0;0;;Philanthropos;;;0;1;0;0;;0;0;0;0;0;;;0;;;0;0;0;0;;0;0;0;0;0;0;0;0;;0;0;1;;;;;;;
28/02/2025;Vacances;Evreux/Fribourg;;;7;Réveil un peu lent, du temps à me préparer, c'est dommage car j'ai pas pu lire longtemps à la bibliothèque, on part avec Laetitia à la gare à pied, on passe par le vieux Fribourg, très beau, on papote puis train pour Lausanne où j'avance la lecture de DG et Bonaparte, on mange un sandwich au soleil puis train jusqu'à Paris, lis mais pas efficace, prends les notes des photos du livre de De Villiers, dors un peu et écoute un peu CNews, on arrive à Paris, on va à Saint Lazare, lis assez efficacement, papa vient nous chercher à la gare, on arrive à la maison, on se pose, un peu sur mon tel, mes à jour la BDD puis dîner sympa tous les 4, c'est dommage, je perds du temps après le dîner, commence Pierrot le fou assez tard, ne le finis pas car mims veut dormir, il me reste 30 minutes, vais au lit, CP avant de dormir;08:24:00;08:30:00;23:57:00;00:01:00;;125;260;87;3;;;89;45;0;Assez en forme;Aucun;8101;0;;;22;10;45;142;0;;;;;;;;;Moyenne;Pas mal;;Aucun;;;;;;;;;;;;;;;;;156;37;31;6;0;0;0;68;Mi beau temps mi moyen;;;;0;0;;;;0;;;;;;;;1;;0;;30;0;;;Train;;1;1;0;0;;0;0;1;0;0;;;0;;;0;0;0;0;;0;0;0;0;0;0;0;0;;0;0;;;Deux moments où je perds du temps : au réveil et donc lis peu à la bibliothèque : objectif 100 pages manqué (80). Et après le dîner où je perds environ 30 minutes qui m'empêchent de finir le film. Cela me met en retard pour le lendemain car je devrai lire 20 pages de plus et regarder 30 minutes la fin du film. Dommage mais un bel axe de progression;;Rêve que j'ai 18 au DS de CSOPT contrairement à Matteo qui va aux rattrapages, choqué de mes notes;;;
01/03/2025;Vacances;Evreux;;;7,5;Réveil assez rapide, lis au lit 40 minutes puis me douche, petit-déj et finis Pierrot le fou, continue de lire au lit, petite sieste, continue de lire jusqu'au déjeuner, mets à jour la BDD et les films vu récemment, du temps à me remettre à lire, mange pas mal de sucreries, lis un peu, vais chez Hugo et Louis, on discute ensemble puis avec JP sur la data et ma blessure, on va au salon du vin avec les gars, moment sympa, envie d'y retourner l'année prochaine et de se mettre capot, balade pour baisser l'alcoolémie, rentre à la maison, mets du temps à manger, puis regardre un film (un dimanche à la campagne), le finis au lit car mims voulait dormir, CP avant de dormir, dommage d'être sur les écrans avant de dormir;07:56:00;08:05:00;00:11:00;00:19:00;;112;273;72;26;;;84;39;0;En forme;Aucun;7928;0;;;21;25;43;137;0;;;;;;;;;Assez saine;Beaucoup;2 verres de vin;Correct;;;;;;;;;;;;;;;;;136;22;30;12;0;0;0;52;Pas mal;7,3;280;0;0;1;;;;0;;;;;;;;1;;2;;30;0;;Salon du vin;;;1;0;0;0;;0;0;1;0;0;;;0;;;0;0;0;0;;0;0;1;0;0;0;0;0;;0;0;;Hugo, Louis;;;;;;
