29/01/2024;Mission Sciencéthic;Nantes;;;8;Ne me réveille pas au révéil de 7h35, CB, puis révéil à 9h, ne me douche pas, petit déj, commence le stage à l'appart, EDA jusqu'au RU, beaucoup de queue, solo, balade digestive de 35 minutes, prends mes affaires et vais au RU, continue l'EDA jusqu'à une pause où j'achète du fromage blanc au carrefour, reviens à la BU pour bosser 1h, rejoins Eugé au tram, ciné en 4DX (Mario bros), c'était drôle, TGTG chez ta mère et la tablette, repas avec Flo et Eugé, prépare la conv de mon anniversaire, dodo avec un peu de tel et le JDD;09:00:00;;23:50:00;;;;;;;;;;;;;;;;;;;0;;;0;;;;;;;;;;;;;;;;09:33:00;;251;;;;;;;;;;;5;38;12;;0;8;;58;Pas mal;;;;;;;;;;;;;;;;;;;;;;;;;;;0;;;1;;0;1;1;0;0;;;0;;;0;0;0;0;;;0;0;0;0;0;0;0;;0;;;Flo;Une très bonne journée avec du travail et de l'amusement le soir, 2h à aller chercher, 1h le matin, 1h l'après-midi. Dommage de ne pas m'être levé, mais pas grave je me suis ressaisi;;;104;14;
30/01/2024;Mission Sciencéthic;Nantes;;;6;Réveil un peu fatigué, peti-déj lourd, commence un peu le stage mais pas efficace, démotivé, arrête pour jouer aux échecs, puis sur mon ordi à ne rien faire, RU avec Seb Canaris, balade digestive de 35 minutes, en forme mais vais au lit sur mon tel, CP, sieste, retourne à la BU à 15h, travaille un tout petit peu, puis échecs, ne fais rien, footing 12km avec Boltz et David, fatigué quand je rentre, sur mon tel, perd du temps, Eugé passe un peu, sur mon tel à jouer aux échecs;07:40:00;;23:40:00;;;;;;;;;;;;;;;;;;;20;;;12,7;;David, Boltz;;17:36:00;;;;;;;;;;;;09:03:00;;30;;;;;;;;;;;0;41;29;;60;8;;138;Beau temps;;;;;;;;;;;;;;;;;;;;;;;;;;;0;;;1;;1;0;0;0;0;;;0;;;0;0;0;0;;;0;1;0;0;0;0;0;;0;;;Boltz, David, Flo;Vais à la BU mais ne travaille pas, manque d'habitudes et de discipline;;;110;23;
31/01/2024;Mission Sciencéthic;Nantes;;;6;Pas de réveil, envie de CB, essaie dans la douche, vais au lit, CB, sur mon tel, échecs, vais au RU solo, étend le linge, au lit, twitter, échecs, plus de batterie lis Atomic Habits, balade sans tel au soleil, très agréable, Eugé vient, problème Céline, continue à lire (1/3), début fiche, match Neptunes avec Flo et les gars du rugby, TGTG pizza avec Flo, au lit sur mon tel. 9-00h40. 1h35 d'échecs !;09:00:00;;00:40:00;;;;;;;;;;;;;;;;;;;30;;;0;;;;;;;;;;;;;;;;;;0;;;;;;;;;;;160;35;23;;60;31;;149;Beau temps;;;;;;;;;;;;;;;;;;;;;;;;Match volley;;;0;;;1;;0;0;0;0;0;;;0;;;0;0;0;0;;;0;1;0;0;0;0;0;;0;;;Flo, Sam;Aucune motivation, Atomic Habits fait du bien, superbe balade sans téléphone, continue, inverse la dynamique, puis au retour du volley sur mon tél au lit..;Les agriculteurs aux portes de Paris;;90;14;
01/02/2024;Mission Sciencéthic;Nantes;;;6;Réveil tard, douche puis début bilan journée sur excel, RU solo, au lit sur Twitter et échecs, lis 1h30 Atomic Habits, coiffeur, 1h d'échecs sur l'ordi, continue à lire 25 minutes puis 20 minutes de fiche, joue aux échecs, restau anniv Camille avec Sarah, Will et Emma, Ruin bar avec les autres du restau, vais chez Eugé, on traîne un peu, échecs, Twitter, dodo;10:00:00;;01:00:00;;;;;;;;;;;;;;;;;;;20;;;0;;;;;;;;;;;;;;;;;;0;;;;;;;;;;;115;34;13;;28;7;;82;Médiocre;;;;;;;;;;;;;;;;;;;;;;;;;;;0;;;1;;0;0;0;0;1;;;0;;;0;0;0;1;;;0;1;0;0;0;0;1;;0;;;Sarah, Emma, Flo;Me réveille tard, capable de lire 1h30, pas dans un bon mood, capable d'abandonner trop facilement;;;83;19;
02/02/2024;Mission Sciencéthic;Nantes;;;7;Réveil tard, RU solo, balalde Loire, très beau temps, BU avec Eugé et Sarah l'aprem, mets à jour le bilan journée une fois rentré à l'appart, France-Irlande à la descente avec les copains, branlée, rejoins les CBB et Garance chez Spill, passe rapidement à la roulotte, dodo avec Eugé à la descente, traîne sur mon tel;10:30:00;;02:00:00;;;;;;;;;;;;;;;;;;;0;;;0;;;;;;;;;;;;;;;;14:16:00;;180;;;;;;;;;;;0;29;4;;20;7;;60;Beau temps;;;;;;;;;;;;;;;;;;;;;;;;;;;0;;;1;;0;0;0;0;0;;;0;;;0;0;0;0;;;0;1;0;Rugby;0;0;1;;0;;;Flo, Sam, Emma, Sarah, Céline, Nouhayla;Bonne aprem après une mauvaise matinée;;;120;12;
03/02/2024;Week-end;Nantes;;;8;Réveil en mode larve, CB, sur mon tel, repas solo, reviens au lit, ma journée commence à 16h avec un footing 8km avec Louis Pottier, fin Italie-Angleterre avec Sam, Coco, Mathilde, Barbara, Thomas Cosa et Flo, douche puis crêpes devant Ecosse-Pays de Galles, soldes Devred avec Flo, levrette Café avec Mathilde, Thomas, Barbara et Flo, Maagma puis Papa Doble avec les même plus Sam, Coco, Maïlys, un peu vestiaire, puis dodo avec mon tel. J'ai tellement rigolé, superbe journée, Thomas énorme crack. Enormément de glucose dans la journée;11:00:00;;02:05:00;;;;;;;;;;;;;;;;;;;20;;;8,2;;Louis Pottier;;16:13:00;;;;;;;;;;;;;;0;;;;;;;;;;;0;38;28;;34;7;;107;Moyen;;;;;;;;;;;;;;;;;;;;;;;;;;;0;;;1;;1;0;0;0;0;;;0;;;1;0;0;1;;;0;1;0;Rugby;0;0;0;;0;;;Sam, Flo;énormément de glucose !!;Tentative d'assassinat à la gare de Lyon par un malien détestant la France;;118;35;
04/02/2024;Week-end;Nantes;;;5,5;CB, Réveil tel une larve, regarde un docu sur les rats à Paris, sur mon tel, dors pendant facilement 45 minutes, aide la voisine à transporter ses affaires, achète le JDD, courses, repas léger, sur l'ordi à jouer aux échecs, 45 minutes de résumé de Atomic Habits, fatigué, échecs, vais à la messe avec Eugé, repas burgers chez elle, on parle avec Sarah, retour descente, dodo sur mon tel encore une fois (30 minutes de Twitter);10:30:00;;00:00:00;;;;;;;;;;;;;;;;;;;45;;;0;;;;;;;;;;;;;;;;;;0;;;;;;;;;;;0;31;18;;44;5;;98;Moyen;;;;;;;;;;;;;;;;;;;;;;;;;;;0;;;1;;0;0;0;0;0;;;0;;;0;0;0;0;;;0;1;0;0;0;0;0;;0;;1;Sarah, Flo;dimanche larve aussi à gause de tout le glucose pris la veille;;;86;25;
05/02/2024;Mission Sciencéthic;Nantes;;;7,5;Nuit mauvaise à cause d'un moustique, me réveille très tard, RU solo puis balade, BU, bosse 1h20 pas très efficacement, 1h de lecture Atomic Habits, 1h40 efficace, repas rapide, ciné avec Eugé (OSS117), monoprix avec elle, mange un peu avec elle, on discute avec elle et Sarah, temps calme, Tabernak avec les chupas, Garance et Spill, passe un peu au comptoir, dors avec le JDD;10:30:00;;01:55:00;;;;;;;;;;;;;;;;;;;0;;;0;;;;;;;;;;;;;;;;13:28:00;;180;;;;;;;;;;;70;32;5;;0;3;;40;Médiocre;;;;;;;;;;;;;;;;;;;;;;;;;;;0;;;1;;0;1;1;0;0;;;0;;;0;0;0;1;;;0;1;0;0;1;0;0;;0;;;Sarah, Garance, Boltz, David, Marques, Flo;Bien l'après-midi malgré une matinée à dormir, bien de dormir avec le jdd !;;;130;12;
06/02/2024;Mission Sciencéthic;Nantes;;;6,5;Me lève tard, me prépare assez rapidement, 35 minutes de ML, RU avec Nouhayla puis balade avec elle, reprend à 14h10, encodage pendant 30 minutes puis nouvelle Salameh qui me met dans un mauvais mood, joue aux échecs pour fuir, mets à jour le bilan journée, pause, puis encodage mais pas assez de RAM, trop lent, soldes aux galeries lafayettes, footing fractionnées avec Daphné, David et Eugé, dur, kebab à 5 euros avec Eugé et Flo, sur mon tel en m'étirant, perd du temps, dodo avec le JDD;09:50:00;;23:30:00;;;;;;;;;;;;;;;;;;;0;;;12,3;;Eugé, David, Daphné;;20:00:00;;;;;;;;;;;;10:59:00;;95;;;;;;;;;;;15;36;9;;0;13;;58;Médiocre;;;;;;;;;;;;;;;;;;;;;;;;;;;0;;;1;;1;0;0;0;0;;;0;;;1;0;0;0;;;0;1;0;0;0;0;1;;1;;;Flo, David, Daphné, Nouhayla;;;;143;12;
07/02/2024;Mission Sciencéthic;Nantes;;;8,5;Ne mets pas de réveil, CB, réponds aux messages d'anniversaire, essaie de continuer l'encodage mais bug car pas assez de RAM, cherche des jeux de société pour la soirée, RU avec Eugé, elle m'offre mes cadeaux à la descente, temps calme avec elle, cherche à la fnac les deux jeux, perd 2 heures au lit à ne rien faire, CP, twitter, échecs, appel Elliot, préparation salon, cuisine, chambre, cherche les pizzas, soirée jeu superbe avec tous les copains, Trou noir à 21 puis Two Room a bomb à 22, j'ai adoré, dodo chez Eugé;09:00:00;;01:45:00;;;;;;;;;;;;;;;;;;;20;;;0;;;;;;;;;;;;;;;;;;0;;;;;;;;;;;0;62;10;;29;6;;107;Très mauvais temps;;;;;;;;;;;;;;;;;;;;;;;;Soirée jeux de société;;;0;;;1;;0;0;0;0;0;;;0;;;1;0;0;0;;;0;1;0;0;1;0;1;;0;;;Flo, David, Boltz, Marques, Sam, Sarah, Nouhayla, Céline, Emma, Théophile, Garance, Bianca;Dommage de perdre deux heures car j'ai procrastiné sur le devoir de rangement… Je n'ai plus envie de vivre cela, écouter mon corps fatigué alors qu'il y a un évènement le soir, non ! On range on fait le taff et après on voit;Hommage national pour les victimes du 7 octobre;;126;13;
08/02/2024;Mission Sciencéthic;Nantes;;;6,5;Réveil tard chez Eugé, me douche rapidement à la descente, RU avec Eugé, Sarah et Marques, range un peu le salon, CP, étend le linge, arrive à la BU mais fais autre chose (renseigne sur les films…), commence à 15h51, pas assez de RAM, pause avec Sarah 50% d'efficacité mais obtient un premier score de modèle : 99%, trouve cela bizarre, rentre à la descente, essaie de cuisiner mais le briquet de fonctionne plus, ciné avec Boltz, Idir et David (Daaaali!), film nul, kebab à 5 euros avec Boltz et David, on rejoint Bianca, Camille et Hugo au Papa Doble, Apo bosse et Prely arrive, très sympa, je rentre à 00h30, dors à 2h car sur mon tel !! (Flo arrive avec sa meuf);10:40:00;;02:00:00;;;;;;;;;;;;;;;;;;;0;;;0;;;;;;;;;;;;;;;;15:51:00;;65;;;;;;;;;;;0;26;11;;10;10;;57;Mauvais temps;;;;;;;;;;;;;;;;;;;;;;;;;;;0;;;1;;0;1;0;0;0;;;0;;;1;0;0;1;;;0;1;0;0;0;0;0;;0;;;Flo, Bianca, Marques, Boltz, David, Sarah;;Nicole Belloubet nouvelle ministre de l'éducation nationale…;;107;17;
09/02/2024;Mission Sciencéthic;Nantes;;;6,5;Réveil tard, RU avec Eugé, on croise Saad et Sarah, parle avec Sarah, petite balade avec Eugé, BU, lis pendnat 1h le livre sur la data, puis ne fais rien, échecs et co, vidéo pendant 20 minutes sur les modèles de ML à choisir, on s'embrouille un peu avec Eugé, courses au Carrefour, repas chez elle au début tendus puis ça allait mieux, ciné avec elle (La La Land), très bon film, sur mon tel au lit pendant près de 2 heures;11:00:00;;00:30:00;;;;;;;;;;;;;;;;;;;0;;;0;;;;;;;;;;;;;;;;18:21:00;;20;;;;;;;;;;;0;37;7;;23;1;;68;Mauvais temps;;;;;;;;;;;;;;;;;;;;;;;;;;;0;;;1;;0;1;1;0;0;;;0;;;0;0;0;0;;;0;1;0;0;0;0;0;;0;;;Sarah;Accepter le fait qu'Eugé ait ses moments où elle n'est pas dans un bon mood, où elle râle;;;70;6;
10/02/2024;Week-end;Nantes;;;8,5;Réveil au lit, sur mon tel, CP, me lève du lit vers 13h, douche puis carrefour, repas devant Cnews sur le projo, puis Ecosse-France solo, match frustrant mais de la chance, sur mon tel à ne rien faire, puis commence à ranger, à préparer la soirée, cherche l'enceinte chez Eugé puis courses, les amis commencent à venir, Hugo et Seb sont là, très très bonne soirée à la descente puis au LU, dodo dans la chambre de Will;11:00:00;;04:00:00;;;;;;;;;;;;;;;;;;;0;;;0;;;;;;;;;;;Vodka, jager bomb, vin blanc;Beaucoup;;;;;;0;;;;;;;;;;;0;40;20;;40;7;;107;Mauvais temps;;;;;;;;;;;;;;;;;;;;;;;;;;;0;;;1;;0;0;0;0;0;;;0;;;0;0;0;0;;;0;1;0;Rugby;0;1;1;;0;;;Flo, David, Boltz, Sam, Sarah, Emma, Théophile, Garance, Hugo, Seb;;;;126;13;
11/02/2024;Week-end;Nantes;;;8;Réveil dans la chambre de Will, temps calme, réveille Hugo et Seb, on traîne un peu, balade fatigué dans Nantes, Hugo dans un sale état, déjeuner au café de commerce, soleil, ils partent, Will arrive, sur mon tel pendant 45 minutes au lit, verre avec Sarah, Eugé, Flo, Will, Camélia, Céline et Chloé au Ruin bar encore au soleil, ciné avec Eugé (Iron Claw), très bon film, retour à la descente pour chercher de la nourriture, vois Sam rapidement, dîner chez Eugé, temps calme puis dodo avec elle sur mon tel;11:00:00;;00:00:00;;;;;;;;;;;;;;;;;;;0;;;0;;;;;;;;;;;;;;;;;;0;;;;;;;;;;;0;29;14;;47;7;;97;Beau temps;;;;;;;;;;;;;;;;;;;;;;;;;;;0;;;1;;0;1;1;0;1;;;0;;;0;0;0;1;;;0;1;0;0;0;0;1;;0;;;Hugo, Seb, Flo, Sarah, Céline, Sam;;Fin du droit du sol à Mayotte;;71;20;
12/02/2024;Week-end;Nantes/Chasseneuil-du-Poitou;;;7;Réveil difficile fatigué chez Eugé, pas loin d'1 heure à me lever, footing 6km où je rejoins Eugé, RU avec Eugé, range le salon, un peu à la BU, reviens à la descente préparer mes affaires, vais chez Sarah chercher l'enceinte, rejoins Eugé chez Pil Poil, problème voiture, on va au garage, un gentil monsieur nous dépanne, route jusqu'à l'hôtel, pause sympa, repas sympa, parties d'échecs, dodo à l'hôtel ;10:00:00;;00:20:00;;;;;;;;;;;;;;;;;;;0;;;5,9;;Eugé;;11:03:00;;;;;;;;;;;;15:31:00;;30;;;;;;;;;;;0;31;27;;40;5;;103;Pas mal;;;;;;;;;;;;;;;;;;;;;;;;;Voiture;;0;;;1;;1;0;0;0;1;;;1;;;0;0;0;0;;;0;0;0;0;0;0;1;;0;;;Sarah, Flo;;;;97;39;
13/02/2024;Week-end;Chasseneuil-du-Poitou/Nantes;;;8;Super petit-déjeuner à l'hôtel, journée futuroscope, visite Poitiers, Quick, on met un peu de temps à partir, retour un peu long, on écoute Cnews, rentre en tram, cherche les clés au Flam's, Boltz, vient prendre son sac, Flo sonne à 00h30 ce qui me réveille, 30 minutes pour me rendormir;09:30:00;;23:45:00;;;;;;;;;;;;;;;;;;;0;;;0;;;;;;;;;;;;;;;;;;0;;;;;;;;;;;0;31;6;;25;5;;67;Moyen;;;;;;;;;;;;;;;;;;;;;;;;Futuroscope;Voiture;;0;;;1;;0;0;0;0;0;;;0;;;1;0;0;0;;;0;0;0;0;0;0;0;;0;;;Boltz;;Le conseil d'état oblige l'ARCOM à durcir le contrôle éditorial de Cnews;;92;14;
14/02/2024;Mission Sciencéthic;Nantes;;;7,5;Réveil tard, vais à la BU 30 minutes, RU solo, balade puis retour à l'appart, reprise à 13h à la BU, 1h30, je continue mon stage, de la latence, pause à l'appart où je range, 30 minutes de travail (encore de la latence), achète un goûter pour la Saint valentin, verre avec Gaulier au Lily Bag, très sympa, triple date Burger King avec Céline, Eliott, Nouhayla, Léo et Eugé, bar à jeux rapide à Feydeau, mets du temps à aller au lit une fois rentré, Flo avec sa gow, dodo avec un peu de tel puis le JDD;10:00:00;;01:05:00;;;;;;;;;;;;;;;;;;;0;;;0;;;;;;;;;;;2 verres de vin rouge;Correct;;;;10:54:00;;170;;;;;;;;;;;10;23;10;;9;7;;49;Correct;;;;;;;;;;;;;;;;;;;;;;;;;;;0;;;1;;0;0;0;0;0;;;0;;;1;0;0;1;;;0;1;0;0;0;0;0;;0;;;Flo, Charles G, Céline, Nouhayla, Sarah;;;;88;8;
15/02/2024;Mission Sciencéthic;Nantes/Evreux;;;6,5;Réveil, CP douche, 30 minutes rapport, RU solo, balade, retour à la BU où je bosse pendant 1h30 mon modèle, me rend compte de l'erreur (quantité, total), vois Eugé en vitesse, train Nantes-Paris où j'essaie d'exécuter le programme et lis Goldnadel, Paris-Evreux où je continue de lire, retour maison, repas, on discute ML avec papa, dodo avec le JDD;09:35:00;;00:30:00;;;;;;;;;;;;;;;;;;;0;;;0;;;;;;;;;;;;;;;;;;120;;;;;;;;;;;100;28;37;;13;4;;82;Correct;;;;;;;;;;;;;;;;;;;;;;;;;Train;;1;;;1;;0;0;0;0;0;;;0;;;0;0;0;0;;;0;0;0;0;0;0;0;;1;;;;;;;97;40;
16/02/2024;Mission Sciencéthic;Evreux;;;6;Relance le programme vers 7h, me réveille, le programme est toujours en cours d'exécution, CP, journée larve, échecs, est bloqué à cause de la latence, footing 6km vers 18h30 (d'abord avec Twist puis solo), dîner avec les parents, film solo (Simone, le voyage du siècle), appel Eugé au lit;10:00:00;;01:15:00;;;;;;;;;;;;;;;;;;;20;;;6;;;;18:48:00;;;;;;;;;;;;;;0;;;;;;;;;;;0;38;20;;60;0;;118;Moyen;;;;;;;;;;;;;;;;;;;;;;;;;;;1;;;0;;1;0;1;0;0;;;0;;;0;0;0;0;;;0;0;0;0;0;0;0;;0;;;;Sympa le film solo dans la home cinéma;Mort de Navalny;;75;24;
17/02/2024;Week-end;Rouen/Evreux;;;8;Réveil, au lit à jouer aux échecs sur l'ordi, je lis un peu le JDD, sieste, déjeuner avec Mims, lis 30 minutes Goldnadel, essaie de regarder Titane mais ne trouve pas le film, vais à Rouen, achète Thaï, soirée chez Hugo où je revois Seb, Louis, Adam, Thomas, très sympa, vais à l'appart de Laetitia avec Seb et Louis, on discute, dodo tard;09:00:00;;04:00:00;;;;;;;;;;;;;;;;;;;20;;;0;;;;;;;;;;;;;;;;;;0;;;;;;;;;;;40;59;15;;30;6;;110;Pas mal;;;;;;;;;;;;;;;;;;;;;;;;;Voiture;;1;;;0;;0;0;0;0;0;;;0;;;1;0;0;0;;;0;1;0;0;1;0;0;;0;;;Hugo, Louis B, Adam, Seb, Thomas;;;;133;17;
18/02/2024;Week-end;Evreux;;;5,5;Me réveille chez Laetitia, CP, me prépare, rentre, achète le JDD à la Madeleine, aprem larve, repas puis sur l'ordi où j'essaie de télécharger Jupyter Notebook devant la télé, dors avec le tel;12:00:00;;01:20:00;;;;;;;;;;;;;;;;;;;40;;;0;;;;;;;;;;;;;;;;;;0;;;;;;;;;;;0;39;25;;60;8;;132;Mauvais temps;;;;;;;;;;;;;;;;;;;;;;;;;Voiture;;1;;;0;;0;0;0;0;0;;;0;;;0;0;0;0;;;0;0;0;0;0;0;0;;0;;;;Dois trouver une solution pour les CP et CB, habitude ancrée pour me lever et à d'autres moments de la journée;;;88;26;
19/02/2024;Mission Sciencéthic;Evreux/Rouen;;;6;Me lève tard, CP sans en avoir envie, essaie de régler le problème de Jupyter Notebook, y arrive, déjeuner, joue aux échecs, sieste, CB, descends, ne fais rien, continue à jouer, beaucoup de goûter sucré, CP douche, vais à Rouen, en retard à cause du CP, dîner pour l'anniv de Thomas avec Louis, Roxane et les parents de Thomas au Cancan, retour avec la BO de La La Land, dodo avec mon tel au début puis lecture du JDD pendant 30 minutes;10:30:00;;00:10:00;;;;;;;;;;;;;;;;;;;20;;;0;;;;;;;;;;;;;;;;11:30:00;;30;;;;;;;;;;;35;22;15;;23;4;;64;Médiocre;;;;;;;;;;;;;;;;;;;;;;;;;Voiture;;0;;;0;;0;0;0;0;1;;;0;;;0;0;0;0;;;0;1;0;0;0;0;0;;0;;;Thomas, Louis B;Aprem sans tel mais fais autre chose, volonté de faire 40 jours sans CP ou CB;;;62;19;
20/02/2024;Mission Sciencéthic;Evreux/Nantes;;;6,5;Réveil à 8h mais me lève à 9h, petit-déj puis près d'1h30 où j'essaie de régler mon problème de latence, traîne un peu, footing 10km avec l'heure des pros, déjeuner, prépare mes affaires puis 4h30 route pour Nantes, écoute le podcast de Noémie Schulz sur Olivia Renen l'avocate de Salah Abdeslam, toujours à fond sur La La Land, repas rapide à la descente puis vais à la roulotte puis ChatHamza, dodo avec le JDD;09:00:00;;00:26:00;;;;;;;;;;;;;;;;;;;0;;;10;;;;13:23:00;;;;;;;;;;;;09:56:00;;83;;;;;;;;;;;20;48;17;;20;10;;95;Correct;;;;;;;;;;;;;;;;;;;;;;;;;Voiture;;1;;;0;;1;0;0;0;0;;;0;;;0;0;0;0;;;0;1;0;0;1;0;0;;1;;;Bianca, Théophile;;;;115;22;
21/02/2024;Mission Sciencéthic;Nantes;;;8;Réveil, petit-déj, BU, opération avancer un max le rapport de semestre, 2h le matin, RU solo, retourne à l'appart, 3h25 l'aprem, perd un peu de temps mais bonne dynamique, rentre à l'appart, 35 minutes de travail en attendant Eugé, temps calme avec elle, super, repas en vitesse puis ciné avec elle (Pauvres Créatures), dodo avec le JDD, 6 heures de travail !;08:15:00;;00:35:00;;;;;;;;;;;;;;;;;;;0;;;0;;;;;;;;;;;;;;;;09:26:00;;360;;;;;;;;;;;10;25;8;;0;2;;35;Mauvais temps;;;;;;;;;;;;;;;;;;;;;;;;;;;0;;;1;;0;1;1;0;0;;;0;;;0;0;0;0;;;0;0;0;0;0;0;0;;1;;;Flo;6 heures de travail, cela faisait très longtemps, pas besoin de faire une sieste, pas de CP ou CB qui rend le temps calme avec Eugé incroyable;;;92;13;
22/02/2024;Mission Sciencéthic;Nantes;;;9;Réveil 15 minutes plus tard que la veille mais commence à peu près à la même heure, 2 heures de rapport le matin, RU solo, reprend à 13h11, rush de 2h pour finir le rapport, 47 pages, travaille un peu la mission Sciencéthic, bar à jeux Feydeau avec Théophile, Samuel, Spill et Camille, ciné avec Eugé, Raph, Maxime (César et Rosalie), excellent film, on se dirige chez Eugé quand tout à coup des cathos nous parlent, petit temps de prière avec eux, superbe moment, on leur laisse notre numéro, Wok Thaï à emporter (Commerce), repas chez Eugé, échecs pendant qu'elle joue au violon, temps calme puis dodo avec Twitter;08:30:00;;01:25:00;;;;;;;;;;;;;;;;;;;0;;;0;;;;;;;;;;;;;;;;09:29:00;;300;;;;;;;;;;;0;19;6;;16;1;;42;Mauvais temps;;;;;;;;;;;;;;;;;;;;;;;;;;;0;;;1;;0;1;1;0;0;;;0;;;1;0;0;0;;;0;1;0;0;0;0;1;;0;;;Théophile;Superbe journée, je vis dans un pays incroyable, BU, RU, bar à jeux, ciné, temps de prière, vive la France. Un travail très bien accompli (9h de rapport en 2 jours + 2h de sciencéthic), je me suis prouvé que j'étais capable de travailler comme une machine pour profiter comme il se devait de ma fin de journée, à continuer...;;;65;14;
23/02/2024;Mission Sciencéthic;Nantes/Saint-Gilles-Croix-de-Vie;;;7,5;Réveil tard chez Eugé, me prépare, 20 minutes de stage, RU avec elle, BU juste après le déjeuner, échecs pendant 1 heure, on achète 2 chemises chez Devred avec Eugé, puis 1h40 de travail, prépare mes affaires pour Saint Gilles puis pour le retour à Evreux, route solo avec l'heure des pros, soirée avec Bianca, Camille, Marin, Théophile et Matteo dans la maison chez Camille, repas, puis jeux (dont le Mytho), Bianca me raconte de ses nouvelles puis dodo;09:45:00;;03:30:00;;;;;;;;;;;;;;;;;;;0;;;0;;;;;;;;;;;;;;;;11:13:00;;120;;;;;;;;;;;0;13;20;;5;3;;41;Mauvais temps;;;;;;;;;;;;;;;;;;;;;;;;;Voiture;;0;;;1;;0;0;0;0;0;;;0;;;0;0;0;0;;;1;1;0;0;1;0;0;;0;;;Bianca, Théophile;Dommage d'avoir joué aux échecs juste après le repas, belle réaction après l'achat des chemises;;;57;26;
24/02/2024;Week-end;Saint-Gilles-Croix-de-Vie;;;9;Matin chill, on se bouge lentement, devant Friends, déjeuner, on va visiter Saint Gilles, bar à saint Gilles, retour incroyable en stop avec Bianca et Marin, découverte de Baptiste, je joue le rôle d'un autiste, dîner avec les copains, jeu des questions, je bois pas mal de vin, casino où je gagne 24 euros, on va sur la piste de danse, Marin fait le show, retour à l'appart, dodo tardif. Journée incroyable avec les copains, vibe de fou;10:45:00;;03:30:00;;;;;;;;;;;;;;;;;;;0;;;0;;;;;;;;;;;Quelques verres de vin rouge;Beaucoup;;;;;;0;;;;;;;;;;;0;30;15;;42;9;;96;Moyen;;;;;;;;;;;;;;;;;;;;;;;;Casino;Voiture;;0;;;0;;0;0;0;0;0;;;0;;;0;0;0;1;;;1;1;0;0;1;0;0;;0;;;Bianca, Théophile;;Salon de l'agriculture houleux;;54;25;
25/02/2024;Week-end;Brest/Nantes;;;6,5;Réveil avant le réveil, je cherche mon chargeur, retour à Nantes, je prépare mes affaires, repas avec Eugé, trajet jusqu'à Brest, Eugé pas dans un bon mood, regarde la première mi-temps de France-Italie sur mon téléphone, 2e mi-temps chez Eugé, match nul honteux, sieste avec Eugé, repas avec les parents puis film (Yannick), dodo sur nos tels;09:50:00;;00:30:00;;;;;;;;;;;;;;;;;;;40;;;0;;;;;;;;;;;;;;;;;;0;;;;;;;;;;;0;13;19;;60;11;;103;Très mauvais temps;;;;;;;;;;;;;;;;;;;;;;;;;;;0;;;1;;0;0;1;0;0;;;0;;;0;0;0;0;;;0;0;0;Rugby;0;0;1;;0;;;;;;;46;30;
26/02/2024;Mission Sciencéthic;Brest;;;7;Début de journée larve, réveil tard, petit-déj très sucré, retourne au lit, échecs, Twitter, redors, déjeuner, temps calme, on rencontre la mamie d'Eugé, gère le préavis à la poste, visite de Brest, verre au bar devant la mer, retour à la maison, recherche rapide d'apparts, repas avec les parents et Eugé, film (je verrai toujours vos visages), dodo avec le JDD;11:00:00;;00:30:00;;;;;;;;;;;;;;;;;;;20;;;0;;;;;;;;;;;;;;;;;;0;;;;;;;;;;;15;12;20;;15;12;;59;Moyen;;;;;;;;;;;;;;;;;;;;;;;;;;;0;;;1;;0;0;1;0;0;;;0;;;0;0;0;1;;;0;0;0;0;0;0;1;;1;;;;;;;28;26;
27/02/2024;Mission Sciencéthic;Brest;;;6,5;Réveil tard, déjeuner direct avec Eugé devant qui veut gagner des millions, temps calme puis sieste, du temps à se mettre en route, mise à jour bilan journée, recherche apparts, pas de travail, footing 9km à Brest, on se balade avec Eugé, failli avoir une amende par les contrôleurs, goûter, un peu d'échecs, douche, puis dîner puis film (le dernier Métro), on recherche les films sur Pathé, un peu d'échecs, un peu de lecture du JDD, on grignote puis dodo;10:30:00;;01:35:00;;;;;;;;;;;;;;;;;;;20;;;8,9;;Eugé;;16:55:00;;;;;;;;;;;;;;0;;;;;;;;;;;10;42;10;;15;6;;73;Correct;;;;;;;;;;;;;;;;;;;;;;;;;;;0;;;1;;1;0;1;0;0;;;0;;;0;0;0;0;;;0;0;0;0;0;0;1;;0;;;;Dommage de ne pas avoir travaillé, dur de se motiver dans un nouveau cadre, + je dors beaucoup trop et perds beaucoup de temps;;;98;20;
28/02/2024;Mission Sciencéthic;Evreux/Brest;;;6,5;Toujours un peu de temps à me lever, une partie d'échecs puis 30 minutes de Power Query, déjeuner avec les parents d'Eugé, départ pour Evreux, petit stop devant la vue du Mont Saint Michel, arrivé à Evreux vers 20h (départ 14h), fin de route fatiguante, repas sympa avec comme jeu TTMC, bonne ambiance;10:00:00;;01:30:00;;;;;;;;;;;;;;;;;;;0;;;0;;;;;;;;;;;;;;;;11:45:00;;30;;;;;;;;;;;10;17;12;;0;6;;35;Mauvais temps;;;;;;;;;;;;;;;;;;;;;;;;;Voiture;;1;;;1;;0;0;0;0;0;;;0;;;0;0;0;0;;;0;0;0;0;0;0;1;;0;;;;;;;46;10;
29/02/2024;Mission Sciencéthic;Evreux;;;6;Réveil tardif avec Eugé, petit déj, 1h de travail, déjeuner devant une vidéo sur Nelson Mandela, échecs au lieu de travailler l'aprem, pas dans un bon mood, footing 11 km avec Eugé, meilleur mood, vais chez le coiffeur mais trop de monde puis Décathlon et Carrefour, c'était long, ça me frustre car l'impression de n'avoir rien fait, repas avec les parents, ça s'éternise mais ça va mieux, dodo avec Eugé, sur mon tel avant de dodo;10:30:00;;01:10:00;;;;;;;;;;;;;;;;;;;0;;;10,8;;Eugé;;17:09:00;;;;;;;;;;;;11:41:00;;0;;;;;;;;;;;0;16;12;;17;5;;50;Médiocre;;;;;;;;;;;;;;;;;;;;;;;;;;;1;;;1;;1;0;0;0;0;;;0;;;0;0;0;0;;;0;1;0;0;0;0;1;;0;;;;J'ai trouvé que papa parlait beaucoup de lui pendant le repas + le fait qu'il parle de façon agressive m'a un peu énervé, je reproduis parfois cela par mimétisme;;;45;16;
01/03/2024;Mission Sciencéthic;Evreux/Paris;;;7;40 minutes pour sortir du lit, pas la deter de travailler, fais des échecs jusqu'au déjeuner, bonne nouvelle de Théophile pour un possible appart dans le 4e, déjeuner puis coiffeur à la Madeleine où j'attends pendant 40 minutes mais prépare mes dépenses, Théophile m'annonce que la visite s'est super bien passée, prépare les affaires puis train pour Paris où j'avance le livre de GWG, ciné dans le 2e à Opéra (la zone d'intérêt), on récupère un TGTG puis rentre chez Seb, galère à ouvrir la porte, repas puis dodo tardif avec mon tel;09:00:00;;00:10:00;;;;;;;;;;;;;;;;;;;0;;;0;;;;;;;;;;;;;;;;;;0;;;;;;;;;;;30;34;8;;0;10;;52;Mauvais temps;;;;;;;;;;;;;;;;;;;;;;;;;Train;;1;;;1;;0;1;1;0;0;;;0;;;0;0;0;0;;;0;0;0;0;0;0;0;;0;;;;;;;59;17;
